SubmissionDate,JASCCode,PartName,PartLocation,Discrepancy
4/17/2008 12:41:07,5320,CHANNEL,BS 574,"AT FS 574 WL 73 QTY ONE CHANNEL OF CARGO DOOR SURROUND STRUCTURE IS CRACKED. CHANNEL AT FS 574, WL 73, REMOVED IAW CRJ SRM 51-42-06 CHANNEL FABRICATED AND TREATED IAW CRJ SRM 51-24-16 AND 51-21-11, 51-25-06 CHANNEL INSTALLED IAW CRJ SRM 51-42-06. (M)"
4/17/2008 13:21:20,5210,STEP,PAX DOOR,"PAX DOOR AFT SIDE PANEL, QTY TWO CRACKS EXIST AT 4 AND 5 STEP. PAX DOOR AFT SIDE PANEL REPAIRED IAW 601R-52-11-702 REV A. (M)"
3/31/2022 12:09:31,5341,NONE,FS 516.00,"ANGLE STIFFENER AT FS 516.00, ON LH BL 45.00 IS CRACKED AS MARKED ****AIRCRAFT REMOVED FROM SERVICE*** REMOVED CRACKED STIFFENER AND INSTALLED NEW ANGLE STIFFENER AT FS 516.00 ON LH BL 45.00 IAW ED# AWAC-CRJ253-01817"
6/22/2016 7:52:17,5240,DOOR,CABIN,SERVICE DOOR WILL NOT OPEN FROM THE OUTSIDE.
4/17/2008 13:19:03,5210,STRUCTURE,PAX DOOR,CRACKS ON FORWARD AND AFT ON PAX DOOR UNDER STEP PLATE. REPAIRED IAW REO 601R-52-11-279. (M)
4/17/2008 12:39:40,5320,SILL,BS 559-621,"BTW FS 621 TO FS 559 PLUS 112, WL 73, FLOOR SILL IS CORRODED AT NUT PLATES LOCATION. CORROSION BETWEEN FS 559 PLUS 112 TO 621 WL 73 FLOOR SILL REMOVED IAW CRJ200 SRM 51-21-06 AND WITHIN LIMITS IAW SRM 53-61-23. (M)"
4/17/2008 12:52:03,5210,DRAG ANGLE,PAX DOOR,PAX DOOR AFT WEB DRAG ANGLE IS CRACKED. REPAIRED IAW REO 601R-52-11-513 REV A. (M)
4/17/2008 12:59:53,5315,FLOORBEAM,BS 280,CRACK FOUND ON FS 280 LBL 9 ON FLOOR STRUCTURE. REPAIRED IAW CRJ200 REO 601-53-11-171 REV D ON FS 280 LBL 9. (M)
4/17/2008 12:32:59,5210,HINGE,DOOR STEP,PAX DOOR FOLDING STEP UPPER HINGE FOUND CORRODED. PAX DOOR FOLDING STEP UPPER HINGE REPLACED WITH SERVICEABLE ITEM IAW CRJ 200 SRM 51-40-11 AND 51-41-04. (M)
4/17/2008 12:55:30,5210,STEP,PAX DOOR,TOP STAIR ASSY IS PUNCTURED IN THE TREAD AREA. TOP STAIR ASSY PUNCTURED AREA REPAIRED IAW REO 601R-52-11-1457. (M)
4/17/2008 12:56:59,5340,BRACKET,FUSELAGE,"CARGO POST NET BRACKET COMMON TO FORWARD FACE CRACKED, LOWER BRACKET. BRACKET REMOVED IAW SRM 51-42-06, BRACKET FABRICATED IAW SRM 51-24-21 AND FABRICATED BRACKET INSTALL IAW SRM 51-42-06. (M)"
9/19/2003 13:21:10,7200,ENGINE,NR 1,"UPON TAKEOFF NOTED NR 1 ENGINE ITT AT 900. DURING CLIMB NOTED ITT AT 858-874. AT FL280 HEARD THUMP AND NR 1 ENGINE SPOOLED DOWN. SECURED PER QRH AND COMPLIED WITH SINGLE ENGINE OPERATIONS. REMOVED AND REPLACED NR 1 ENGINE. SHOP REPORT REMARKS, REPLACED NR 3 BEARING AND FAN DRIVE SHAFT. TESTED ENGINE PER SEI - 756. (M)"
4/27/2012 6:44:20,5280,STRUCTURE,LT MLG DOOR,"LT MLG DOOR CHAFED ON LWR L/E. REMOVED UNSERVICEABLE FILLER AND INSTALLED SERVICEABLE FILLER IAW REO 601R-52-82-034, REV INC."
4/27/2012 6:46:51,5210,HANDLE,PAX DOOR,PAX DOOR EXTERNAL HANDLE CRACKED. R & R WITH NEW SERVICEABLE HANDLE PN 601R31763-1.
4/17/2008 13:22:33,5320,SILL,SERVICE DOORWAY,SERVICE DOOR SILL PLATE CORRODED. SERVICE DOOR SILL PLATE REPLACED IAW CRJ 200 SRM 51-41-04. (M)
4/17/2008 13:40:45,5420,RETAINER,PANEL SEAL,"RIGHT ENGINE, PYLON PANEL 422 DB SEAL RETAINER IS CRACKED. REPLACED IAW CRJ 200 SRM 51-42-06. (M)"
4/27/2012 7:26:23,5320,SILL,FS 310-349,SERVICE DOOR LOWER SILL IS CORRODED ON THE AFT & END WHERE SILL IS RIVETED TO THE FLOOR CROSSBEAM. REPAIRED DAMAGED AREA IAW REO 601R-53-21-2283.
4/27/2012 7:30:46,5320,FLOOR SUPPORT,FS 589,FLOOR SILL SUPPORT ANGLE AT LT FLOOR SILL FS 589 CRACKED. REMOVED UNSERVICEABLE SILL SUPPORT ANGLE AT LT FLOOR SILL FS 589 AND REPLACED WITH SERVICEABLE FLOOR SILL SUPPORT ANGLE IAW SRM 51-61-23 AND SRM 51-42-21.
4/27/2012 7:33:50,5280,STRUCTURE,RT MLG DOOR,"RT MLG DOOR CHAFED ON LOWER L/E. REMOVED, FABRICATED, AND INSTALLED NEW FILLER FORM 412 IAW REO 601R-52-82-034."
4/27/2012 7:37:00,5280,STRUCTURE,RT MLG DOOR,RT MLG DOOR CHAFED ON LOWER T/E. REPAIRED RT MLG DOOR CHAFED AREA AT T/E IAW REO 601R-52-82-334.
4/17/2008 12:58:27,5315,FLOORBEAM,BS 280,CRACKS FOUND ON FS 280 RBL 9 ON FLOOR STRUCTURE. REPAIRED IAW REO 601R-53-11-1366 REV A. (M)
4/9/2010 6:13:34,5320,FLOOR SUPPORT,BS 280,FLOOR SUPPORT CRACKED AT FS 280 APPROX LBL 9 BY MLG MANUAL RELEASE CABLE PULLEY BRACKET REO 601R-53-11-137 CARRIED OUT.
11/29/2004 10:10:07,5753,SKIN,RT IB FLAP,"RT IB FLAP BOTTOM SKIN IS DENTED APPROX .7500 INCH LONG X .6250 INCH WIDE AND .040 DEEP WITH GOUGES IN CENTER OF DENT. DENT IS 1.7500 INCH FORWARD OF AFT EDGE AND 8 INCH OB FROM IB ENGINE. PERFORMED A MAJOR REPAIR BY CUTTING OUT DAMAGED SKIN AND INSTALLING DOUBLER AND FILLER IAW REO 601R-57-52-058, REV A."
4/17/2008 13:24:05,5315,FLOORBEAM,BS 621,"FLOOR SUPPORT ANGLES AT FS 621, WL 73, LBL 40 AND RBL 40 ARE CRACKED. REPAIRED IAW REO 601R-53-61-117 REV C. (M)"
4/23/2008 13:14:27,5220,SHAFT,HATCH HANDLE,CREW ESCAPE HATCH OUTER HANDLE CORRODED ON SHAFT DURING C-CHECK. REPLACED HANDLE ASSEMBLY. (M)
5/28/2010 10:43:15,5751,SKIN,RT WING AILERON,"RT AILERON UPPER SKIN L/E CHAFED. REPAIRED CHAFE DAMAGE IAW REO 601R-57-60-013, REV NC AND REO 601R-57-60-072 REV. ORIGINAL."
4/27/2012 8:18:44,5320,SILL,PAX DOORWAY,"PAX DOOR CUT OUT LOWER SILL IS CORRODED IN SEVERAL PLACES ALONG THE ENTIRE LENGTH OF THE SILL. REMOVED CORRODED PAX DOOR LOWER SILL THEN FABRICATED NEW LOWER SILL AND INSTALLED IAW SRM 51-24-16, 51-40-02, 51-42-06."
4/27/2012 10:03:35,5320,SILL,FS 574,"CARGO DOOR SILL HAS CORROSION AROUND NUT PLATES ON TOP AND BOTTOM SIDES. REMOVED DAMAGED SECTION AND INSTALLED SERVICEABLE SECTION OF SILL IAW REO 601R-53-61-690, REV D IAW SRM 51-42-06, 51-40-11, 51-42-21."
4/27/2012 10:06:29,5320,BRACKET,FS 171,LEFT LOWER NOSE HYD COMPARTMENT AT NR 3 BRAKE ACCUMULATOR HAS A CRACKED FWD BRACKET. REMOVED UNSERVICEABLE BRACKET AND INSTALLED SERVICEABLE BRACKET IAW SRM.
4/23/2021 8:40:37,2170,LINE,WATER SEPARATOR,"CLIMBING THROUGH FL19.5 RECEIVED CABIN ALTITUDE CAUTION. INITIATED DESCENT AND RECEIVED CABIN ALT WARNING, LITTLE TO NO AIRFLOW FELT IN COCKPIT, C/W QRH IN ITS ENTIRETY. ***AIRCRAFT REMOVED FROM SERVICE*** RE-SECURED LINE TO WATER SEPERATOR REF AMM SUP 15-132A, LEAK CHECK GOOD WITH UNPRESSURIZED A/C USING APU."
8/7/2009 11:10:49,5610,WINDSHIELD,COCKPIT,"IN CRUISE AT 33000 FT, RECEIVED LT WINDSHIELD HEAT CAUTION MSG WINDSHIELD SHATTERED PRIOR TO COMPLETION OF QRH. REMOVED LT WINDSHIELD IAW AMM 56-11-01. REF LOG 191089/6 COMPLETED LT WINDSHIELD INSTALLATION IAW AMM CH 56-11, OPS AND LEAK CHECK GOOD. REF MX M/C NR 3 FOR INSTALLATION OF LT WIPER ARM. (K)"
7/18/2008 14:29:40,2620,EXTINGUISHER,CARGO BAY,CARGO BOTTLE LOWER MESSAGE IN FLIGHT. COMPLIED WITH QRH. R&R LT CARGO FIRE BOTTLE IAW AMM 26-25-01. CHECKS GOOD. NO AIR LEAKS FOUND AND NO SMOKE PRESENT IN CARGO BAY. OK FOR SERVICE.
2/21/2018 8:25:52,3260,PROXIMITY SENSOR,NLG,"DEPARTING TYS GEAR DISAGREE WARNING. NOSE DOOR OPEN. NOSE GEAR DOWN. DID NOT RETRACT. FOLLOWED QRH & MANUAL GEAR EXTENSION. GEAR HANDLE DOWN. GEAR EXTENDED. 3 GREEN. EMERGENCY EXTENSION HANDLE STOWED. LANDED AT 46,500 SMOOTHLY. BTMS READS 3-2-1-2. ADJUSTED NOSE LANDING GEAR PROX SENSOR CENTERING/EXTENDED IAW AMM 32-61-05-05, OPS CHECK GOOD. RETRACTION CHECK GOOD,"
9/21/2020 9:57:37,5330,SKIN,BS 660,"DENT AT FS 660.9 & S22R-2"", DENT MEASURED AT .5"" L X .5"" W X .005"" D WITH A W/D=100 ADDITIONAL DENT IDENTIFIED ON AERSALE W/O 002862 CARD NO 453-900-501-N0002 FOUND AT FS 657.80 & S22R+2"" THAT MEASURES .7""L X .7""W X .009""D WITH A W/D=77. BOTH DENTS ARE NOT WITHIN ALLOWABLE LIMITS FOR BEING IN ADJACENT BAYS, REF CRJ 200 SRM 53-00-31 FIG 103 SH 3 AND SH 4. AIRCRAFT REMOVED FROM SERVICE. CUT DAMAGE AREA OUT 7"" X 4.8"" HFEC PERFORMED, NO DEFECTS NOTED. FABRICATED 8""X 8.5"" DOUBLER, AND FILLER FROM 2024 T3 .063"" INSTALLED PERMANENT REPAIR BETWEEN FS 654.5 TO 672.2 & S22R, REF CRJ 200 SRM 53-00-31 REPAIR 3 REV 38."
8/5/2013 12:00:23,3320,BALLAST,CABIN LIGHTS,"ELECTRICAL ODOR FROM ROWS 1-4 IN CEILING. INSPECTED ROWS 1-5 ABOVE CEILING PANELS FOR EVIDENCE OF ODOR/ANY SIGN OF DISCOLORED AREAS ON WIRES AND INSULATION. FOUND ROWS 2-3 LIGHT BULBS BLOWN SUSPECT BAD BALLAST. R & R BALLAST AND BULBS IAW AMM 33-21-04 AND 33-21-01. OP CHECKED GOOD, NO FURTHER ODOR NOTED NO OTHER DISCREPANCIESNOTED IN AREA. ACFT OK FOR SERVICE."
9/22/2020 9:39:23,5710,SHROUD,RT LEADING EDGE,"TWO CRACKS FOUND ON RT LEADING EDGE PANEL 630KL AT AROUND W/S 314.50. THE FIRST CRACK WAS 8.44"" FROM THE INBOARD EDGE THAT MEASURED .7"" AND THE SECOND CRACK WAS 6.75"" FROM THE OUTBOARD EDGE THAT MEASURED 1.3"". AIRCRAFT REMOVED FROM SERVICE. REMOVED SHROUD (PANEL 630KL). FABRICATED NEW SHROUD FROM 2024 T3 .016"", REF CRJ 200 SRM 57-41-29 AND 51-40-11 REV 30. TREATED AND PRIMED, REF CRJ 200 SRM 51-21-11 & 51-21-06. INSTALLED SHROUD (PANEL 630KL) ON LEADING EDGE AT W/S 314.50, REF CRJ 200 SRM 51-42-10 REV 38."
12/7/2004 10:02:15,3210,BUSHING,MLG TRUNNION,LT MAIN LANDING GEAR AFT TRUNNION BUSHING MIGRATED 0.005 INCH. REMOVED LT AFT MLG TRUNNION BUSHING IAW AMM 20-26-00-910-803. INSTALLED A NEW OVERSIZE (2ND) BUSHING PN 601R5721003-23. IAW REO 601R57-21-003B. REAMED INSIDE DIA TO 2.4384 IAW DWG 601R85007RWC.
4/25/2016 10:09:37,5340,FITTING,FUSELAGE,FS 484.00 CLIP AT LBL 36 IS CRACKED. REPLACED FS 484.00 CLIP AT LBL 36 IAW REO 601R-53-41-059 REV B.
4/25/2016 10:09:37,5720,ANGLE,RT WING,"RIGHT WING INNER SHROUD CRACKED AT WS 143.189. R & R INNER SHROUD ANGLE IAW SRM 51-41-02, 51-42-10 & 51-42-06."
2/18/2020 11:16:38,3040,CONTROLLER,WINDSHIELD HEAT,"EN ROUTE TO SAV, THE FLIGHT EXPERIENCED A RH WINDSHEILD HEAT CAUTION MESSAGE. AFTER FOLLOWING THE QRH, THE MESSAGE PERSISTED. THE FLIGHT COULD NOT CONTINUE TO SAV DUE TO ICING CONDITIONS, DIVERTED TO DAY FOR REPAIR. AIRCRAFT REMOVED FROM SERVICE TROUBLESHOT AND REMOVED AND RPELACED RHJ WINDSHIELD TEMP CONTROLLER IA W AMM 30-41-01. OPS CHECK GOOD."
4/25/2016 10:09:37,5340,BRACKET,FUSELAGE,SYSTEM 2 HYD ACMP CASE DRAIN FILTER BRACKET IS CRACKED. REPLACED BRACKET FOR NR 2 HYD ACMP CASE DRAIN FILTER IAW SRM 51-42-06.
4/25/2016 10:09:38,5320,INTERCOSTAL,FUSELAGE,RIGHT OBLIQUE INTERCOSTAL FS 625.00 IS CRACKED. REPLACED RT OBLIQUE INTERCOSTAL IAW SRM 51-42-21.
4/25/2016 10:09:37,5210,SUPPORT ANGLE,PAX DOOR,PASSENGER DOOR AFT RISER SUPPORT ANGLE IS CRACKED. REPLACED DAMAGED SECTION OF PAX DOOR AFT RISER SUPPORT ANGLE IAW REO 601R-52-11-513 REV B.
4/25/2016 10:09:37,5347,SEAT TRACK,FUSELAGE,"LEFT SIDE WALL SEAT TRACK STICK NR 8 HAS CORROSION, BETWEEN FS 559+16 & 559+80 IN THE CABIN. REPLACED SEAT TRACK NR 8 ON LT SIDEWALL IAW SRM 51-41-02 & AMM 53-01-11."
4/25/2016 10:09:37,5340,ATTACH FITTING,COCKPIT,PILOTS WINDOW SIDE POST LOWER AFT ATTACH FITTING IS CRACKED. REPLACED PILOTS WINDOW LOWER AFT FITTING IAW SRM 51-42-21.
4/25/2016 10:09:37,5340,FITTING,FUSELAGE,"FS 484.00 CLIP AT LBL 27 IS CRACKED. REPLACED FS 484.00 CLIP AT LBL 27 IAW SRM 51-42-21, 51-40-11, 53-41-43 & REO 601R-53-41-059 REV B."
4/25/2016 10:09:37,5420,RETAINER,RT PYLON,RIGHT PYLON PANEL 422DB HAS A CRACKED SEAL RETAINER. REPLACED SEAL RETAINER IAW CMM 20-40-11 & 20-42-03.
4/26/2023 11:07:21,8000,UNKNOWN,UNKNOWN,"IN CRUISE FLIGHT, R ENG START STATUS MESSAGE AND NO STRTR CUTOUT CAUTION MESSAGE APPEARED INTERMITTENTLY FOR DURATION OF FLIGHT. RAN QRH AND DIVERTED. STATUS MESSAGE PERSISTS WITH ENGINES AND APU OFF. *******AIRCRAFT REMOVED FROM SERVICE********** IN WORK"
4/26/2023 11:07:21,8000,UNKNOWN,UNKNOWN,"IN CRUISE FLIGHT, R ENG START STATUS MESSAGE AND NO STRTR CUTOUT CAUTION MESSAGE APPEARED INTERMITTENTLY FOR DURATION OF FLIGHT. RAN QRH AND DIVERTED. STATUS MESSAGE PERSISTS WITH ENGINES AND APU OFF. ******AIRCRAFT REMOVED FROM SERVICE********* IN WORK"
3/31/2022 12:09:31,5320,STIFFENER,FS 516.00,"ANGLE STIFFENER AT FS 516, ON RH BL 45.00 IS CRACKED AS MARKED ****AIRCRAFT REMOVED FROM SERVICE **** REMOVED CRACKED ANGLE STIFFENER AND INSTALLED NEW ANGLE STIFFENER AT FS 516.00 ON RH BL 45.00 IAW ED# AWAC-CRJ 253-01818"
3/31/2022 12:09:31,5100,NONE,,"PREVIOUS BULKHEAD REPAIR, WAS NON-COMPLIANT WITH REO 601R-53-61-1240 NOTE 20 ****AIRCRAFT REMOVED FROM SERVICE **** REPAIRED AFT PRESSURE BULKHEAD IAW 601R-53-61-7793"
5/4/2012 7:15:23,5320,ANGLE,FS 484,"REPAIR ANGLE AT FS 484, LBL 27 CRACKED. REPLACED 484 LBL 27 ANGLE WITH SERVICEABLE IAW REO 601R-53-41-099."
4/16/2010 6:24:44,5312,BULKHEAD,BS 280,"DEEPLY GOUGED PN 2 PLACES APPROX 2` ABOVE FLOOR AT APPROX RBL 9 AFT SIDE COCKPIT ENTRY WAY. REPAIRED DAMAGED AREA AT 280 BULKHEAD APPROX 2` ABOVE FLOOR APPROX RBL 9 AFT SIDE COCKPIT ENTRY IAW REO 601R-53-11-1727, REV C."
9/23/2020 7:39:41,5330,SKIN,BS 679.8,"DENT AT FS 679.8 & S22R-1 THAT MEASURES .8"" L X .8"" W X .006"" D WITH A W/D=133 AND IS LESS THAN 1"" FROM S22R. DENT IS NOT WITHIN ALLOWABLE LIMITS, REF CRJ 200 SRM 53-00-31 FIG 103 SH 3 AND SH 4. AIRCRAFT REMOVED FROM SERVICE. CUT DAMAGE AREA OUT 1.5"" X 1.2"" W CUTOUT HFEC NO INDICATIONS NOTED AT THIS TIME. FABRICATED REPAIR DOUBLER 4.5"" L X 4.5"" W FROM 2024 T3 .063"". INSTALLED DOUBLER, REF CRJ 200 SRM 53-00-31 REPAIR 3 REV 38."
11/24/2014 9:18:01,3010,ANTI-ICE SYSTEM,RT WING,ON TAKEOFF ROLL RECEIVED RT WING ANTI-ICE CAUTION MSG. ABORTED TAKEOFF 80KTS. 14TH STAGE ISOLATION VLV WOULD NOT OPEN. STBY MODE IS OPERATIVE.
11/26/2014 14:04:26,3010,PRESSURE SWITCH,ANTI-ICE SYSTEM,"IN FLIGHT RECEIVED RT WING ANTI-ICE CAUTION MSG IN STBY MODE. 14TH ISO WAS INTERMITTENT, OPEN & CLOSED. PICKING UP ICE ON RT WING WHILE RT WING ANTI-ICE MSG WAS OUT, WING SHOULD BE HEATING & WING & COWL ADVISORY MSG'S WERE ON NORMAL MODE IS ON MEL. EMER DECLARED. R & R RT PRESS SWITCH IAW AMM 30-12-00. OPERATIONS CHECK OF NORM MODE IS GOOD. PLACARDED & PLACED ON MEL. SN OFF 3018 & SN ON 4785."
1/5/2007 13:04:32,2170,COALESCER BAG,,"DURING POST DE-ICING RUN UP, RECEIVED LAV SMOKE MESSAGE. COMP;IED WITH QRH AND MESSAGE CLEARED. PERFOMED LAV SMOKE DE4TECTOR TEST IAW AMM. OPPS CHECKED GOOD. REMOVED AND REPLACED COALESCER BAGS IAW AMM, OPS CHECK GOOD. NO MESSAGE OR SMOKE SMELL FOUND. (K)"
1/8/2007 7:34:17,3310,WIRE,MAP LIGHT,"ENROUTE, SPARKS OBSERVED COMING FROM F/O`S YOKE MAP LIGHT. CB2U6 POPPED. LOOSE CONNECTION ON F/O`S MAP LIGHT FOUND. RESECURED LOOSE CONNECTION. OPS CHECK GOOD IAW 33-13-13. (K)"
6/12/2003 15:35:45,3510,LINE,OXYGEN MASK,OXYGEN MASK SUPPLY LINE FAILED. COCKPIT 02 SUPPLY DEPLETED. INSTALLED NEW SUPPLY HOSE FROM OBSERVERS OXYGEN STORAGE BOX AND RECHARGED OXYGEN SYTEM TO 1520 PSI. NO FURTHER LEAKS NOTED. (M)
9/8/2011 9:26:44,3350,LIGHT,CABIN,NR 2 AND NR 4 OVERHEAD EMERGENCY LIGHTS ARE OUT. (FLT 5318) RELAMPED EMERGENCY LIGHTS.
3/16/2012 15:11:53,3350,LIGHT,CABIN,NR 1 OVERHEAD EMERGENCY LIGHT IS OUT. (FLT 5588) RELAMPED EMERGENCY LIGHT.
8/3/2011 16:12:00,3350,LIGHT,CABIN,NR 1 OVERHEAD EMERGENCY LIGHT IS OUT. (FLT 6407) RELAMPED EMERGENCY LIGHT.
11/15/2017 12:09:08,3230,SELECTOR VALVE,MLG,RETURN TO FIELD FOR A GEAR DISAGREE AFTER TAKEOFF. NOSE GEAR DID NOT COME UP. REPLACED THE LANDING GEAR HANDLE AND MLG SELECTOR VALVE IAW AMM. OPS CHECKED GOOD.
11/30/2010 14:13:25,3350,LIGHT,CABIN,THE 2ND TO LAST OVERHEAD EMERGENCY LIGHT IS BURNED OUT. (FLT 6393) RELAMPED EMERGENCY LIGHT.
5/14/2012 17:22:06,3350,LIGHT,CABIN,NR 1 OVERHEAD EMERGENCY LIGHT IS OUT. (SERVICE) RELAMPED EMERGENCY LIGHT.
12/5/2017 9:40:45,3234,CONTROL HANDLE,COCKPIT,"LANDING GEAR DID NOT RETRACT, WITH A/SKID INB CAUT AND PARK BRAKE SOV CAUTION. (FLT 5197) CLOSED REMOVED AND REPLACED LANDING GEAR CONTROL HANDLE IAW AMM. REMOVED AND REPLACED PSEU IAW AMM. OPS CHECK GOOD AT THIS TIME."
8/10/2011 18:00:30,3350,LIGHT,CABIN,NR 3 OVERHEAD EMERGENCY LIGHT IS OUT. (FLT 5479) RELAMPED EMERGENCY LIGHT.
6/14/2024 14:45:19,3260,WARNING MESSAGE,MLG,"D: GEAR DISAGREE ON APPROACH FOLLOWED BY NOSE DOOR OPEN. QRH RESOLVED ISSUE.C: MEL 32-30-1CAT A DUE ONE FLIGHT DAY FROM 6/13/24CAT II DOWNGRADEDGEAR DISAGREE ON APPROACH FOLLOWED BY NOSE DOOR OPEN. QRH RESOLVED ISSUE. (FLIGHT 5587 - FILED CLOSED) JUN 14, 2024 STATION: DLH--DEFERRED LANDING GEAR RETRACTION SYSTEM PER CRJ 200 MEL 32-30-1. MX ACTION COMPLIED WITH AND PLACARDS INSTALLED. A/C IS CAT II DOWNGRADED"
8/23/2013 17:35:07,5210,MOTOR,CABIN DOOR,MCD DOES NOT OPEN BECAUSE OF JAMMED CABLE. FLT#5257 REPLACED PAX DOOR MOTOR IAW AMM. PN'S 2R5206B SN ON A0415 SN OFF A1019.
3/10/2025 16:10:55,3150,STALL WARNING,,"STALL FAIL CAUTION AFTER ROTATION (FLIGHT 5118 - FILED CLOSED) CONSULTED THE FLIGHT CREW, THE CAPTAIN INFORMED ME THEY THERE WAS A 24 KNOT CROSSWIND ON TAKEOFF. COMPLIED WITH FMRP, AND APPLICABLE STEPS IN FIM 27-35-00. STALL FAIL CAUTION MESSAGE DID NOT POSTED."
7/17/2009 16:19:02,5340,ATTACH FITTING,INTERCOSTAL,INTERCOSTAL CLIPS CRACKED. (C CHECK) REPAIRED PER REO.
7/25/2011 17:40:23,3350,LIGHT,EXTERIOR,LEFT FORWARD EXTERIOR EMERGENCY LIGHT IS OUT. (SERVICE) RELAMPED EMERGENCY LIGHT.
12/16/2011 16:33:18,3350,LIGHT,CABIN,NR 1 AND 2 OVERHEAD EMERGENCY LIGHTS ARE OUT. (FLT 5322) RELAMPED EMERGENCY LIGHT.
5/10/2006 14:49:08,2750,CONTROL UNIT,TE FLAPS,FLAP HALFSPEED STATUS WHEN FLAPS MOVED FROM 30 TO 45. REPLACED FECU IAW 27-51-05. OPERATIONAL CHECKS GOOD.
9/22/2010 15:09:21,3350,LIGHT,CABIN,LAST EMERGENCY FLOODLIGHT INOPERATIVE. (FLT 6908) RELAMPED EMERGENCY LIGHT.
3/11/2011 14:20:38,5312,BULKHEAD,FUSELAGE,FS 621 BULKHEAD CHAFED AND OUT OF LIMITS. (C-CHECK) REPAIRED PER REO.
3/11/2011 14:20:38,5244,DOOR,TRU,LEFT TRU DOOR SKIN BELOW AFT LATCH IS CRACKED. (C-CHECK) REPLACED SKIN PER SRM.
9/23/2011 13:06:41,3350,LIGHT,CABIN,NR 3 OVERHEAD EMERGENCY LIGHT IS INOPERATIVE. (FLT 5350) RELAMPED EMERGENCY LIGHT.
10/19/2011 18:10:00,3350,LIGHT,CABIN,NR 1 OVERHEAD EMERGENCY LIGHT IS OUT. (FLT 5451) RELAMPED EMERGENCY LIGHT.
3/2/2020 14:10:58,5755,SKIN,LT SPOILER,"LEFT FLIGHT SPOILER LOWER SURFACE HAS 2 EA. DENTS. #1 DENT IS APPROX. .750 INCHES BY .500 INCHES BY.021 INCHES DEEP. #2 DENT IS APPROX. .5 ICHES BY .5 INCHES BY .015 INCHES DEEP. (C-CHECK) RO 2/27/2020 UPON FURTHER REVIEW FOUND A TOTAL OF 4 DENTS. EVALUATED DENTS AND FOUND DENT #2 TO BE WITHIN LIMITS IAW CRJ 200 SRM. DENTS #1, #3, #4 WAS REPAIRED IAW BOMBARDIER REO AND ATTACHED SKYWEST CARD AND M-337. NO WEIGHT CHANGE"
3/2/2020 14:10:58,5313,STRINGER,FUSELAGE,"STRINGER 3L IS CRACKED AT F.S. 379.00. (C-CHECK) RO 2/27/2020 REPAIRED STRINGER 3L AT FS 379.00 BY COMPLYING WITH BOMBARDIER REO AND CRJ 200 SRM COMPLETED FORM M-337,M-131 TOTAL WEIGHT CHANGE +0.12 LBS SEE ATTACHED CONTINUATION CARD AND SKYCARD FOR DETAILS OF WORK PERFOMRED"
3/2/2020 14:10:58,5320,POST,FUSELAGE,"FS409+128 VERTICAL POST LBL18 HAS INDICATIONS .15"" LONG BY 60%FSH IN THE OUTBD V-POST, AND .15"" LONG BY 55% IN THE INBD V-POST UPPER AFT RADIUS @ WS69. FAILED NDT INSPECTION. (C-CHECK) RO 2/27/2020 REMOVED AND REPLACED FS409+128 IAW CRJ 200 SRM, AND BOMBARDIER REO FORMS M-337 AND M-131 AND SKYWEST CARD. SEE ATTACHED CONTINUATION CARD AND SKY CARD FOR DETAILS OF WORK PERFORMED PART FOR PART REPLACEMENT NO WEIGHT CHANGE"
2/8/2012 18:13:54,3350,LIGHT,EXTERIOR,AFT EXTERIOR RIGHT WING EMERGENCY LIGHT IS OUT. (FLT 5652) RELAMPED EMERGENCY LIGHT.
7/23/2004 12:45:37,1420,CONNECTOR,STALL WARN SYS,"STALL PROTECTION SYSTEM WILL NOT PASS TEST. STALL FAIL MESSAGE. FOUND TB75-3 SOCKET -J- DAMAGED. REPLACED TB75-3 IAW MM 24-01-03, 20-18-70. OPERATIONAL CHECK GOOD."
3/2/2020 14:10:58,5320,POST,FUSELAGE,"FS409+128 BL0 LH VERTICAL POST HAS AN INDICATION .2"" LONG BY 60%FSH IN THE UPPER AFT RADIUS @ WS69. FAILED NDT INSPECTION. (C-CHECK) RO 2/27/2020 REMOVED UNSERVICABLE POST AND INSTALLED SERVICABLE POST AT FS 409+128 BL0 IAW CRJ 200 SRM AND BOMBARDIER REO COMPLETED FORM M-131 AND M-337 PART FOR PART REPLACEMENT NO WEIGHT CHANGE SEE ATTACHED CONTINUATION CARD AND SKYCARD FOR DETAILS OF WORK PERFORMED"
3/2/2020 14:10:58,5320,POST,FUSELAGE,"FS409+128 RBL18 OUTBD VERTICAL POST HAS AN INDICATION .15"" LONG BY 60%FSH IN THE UPPER AFT RADIUS @ WS69. FAILED NDT INSPECTION. (C-CHECK) RO 2/27/2020 REMOVED AND REPLACED FS409+RBL18 POST IAW CRJ 200 SRM AND BOMBARDIER REO. FORMS M-337 AND M-131 AND SKYWEST CARD. SEE ATTACHED CONTINUATION CARD AND SKY CARD FOR DETAILS OF WORK PERFORMED PART FOR PART REPLACEMENT NO WEIGHT CHANGE"
6/27/2014 16:04:04,4930,O-RING,APU FUEL,"ACFT INTERIOR HAS AN ODOR OF JET FUEL. R & R O-RING ON ELBOW BETWEEN APU FUEL SHUTOFF VALVE AND FUEL CONTROL UNIT, PN: M25988-2-904 IAW AMM."
3/2/2020 14:10:58,5320,INTERCOSTAL,FUSELAGE,"L/H LOWER WINDSHIELD SUPPORT SIDE POST IS CRACKED. (C-CHECK) RO 2/27/2020 UPON REMOVAL OF L/H LOWER WINDSHIELD SUPPORT SIDE POST FOUND POST NOT TO BE CRACKED FOUND INTERCOSTAL ADJACENT TO POST CRACKED. REINSTALLED SAME SERVICEABLE L/H LOWER WINDSHIELD SIDE POST AND A SERVICEABLE INTERCOSTAL IAW CRJ-200 SRM, COMPLETED AND ATTACHED TASK CARD AND M-337. NO WEIGHT CHANGE. REFERENCE ATTACHED CONINUATION CARD FOR WORK PERFORMED."
3/2/2020 14:10:58,5210,INTERCOSTAL,PAX DOOR,"PAX DOOR INTERCOSTAL DOOR DATUM 2 IS CORRODED. (C-CHECK) RO 2/27/2020 REMOVED AND INSTALLED SERVICABLE INTERCOSTAL DD2 IAW CRJ-200 SRM COMPLETED FORM M-337, M-131 AND SKYWEST TASK CARD. PART FOR PART REPLACEMENT, NO WEIGHT CHANGE."
3/2/2020 14:10:58,5310,BEAM,FUSELAGE,FS 280..00 BEAM IS CORRODED BETWEEN LBL 18 AND RBL 9. (C-CHECK) RO 2/27/2020 REMOVED CORROSION BY REPAIRING FS 280.00 BEAM IAW BOMBARDIER REOS. COMPLETED AND ATTACHED MAJOR REPAIR TASK CARD AND FORM M-337. TOTAL WEIGHT CHANGE +1.13 LBS. REFERENCE CONTINUATION CARD FOR WORK PERFORMED.
3/2/2020 14:10:58,5315,FLOORBEAM,FUSELAGE,RBL 9 FLOOR BEAM CAP IS CORRODED BETWEEN FS 409.00+128 AND 424.00. (C-CHECK) RO 2/27/2020 REMOVED CORROSION FROM RBL 9 FLOOR BEAM AND FOUND IT WAS OUT OF LIMITS. REMOVED DAMAGED SECTION AND FABRICATED FILLER AND ANGLE AND INSTALLED REPAIR IAW BOMBARDIER REO. COMPLIED WITH FORM M-337 AND SKYCARD. MATERIAL INSTALLED IS 1OZ.NET WEIGHT.
3/2/2020 14:10:58,5320,DOOR SILL,FUSELAGE,L/H PRESSURE FLOOR SILL DECK IS CORRODED IN MULTIPLE LOCATIONS BETWEEN FS 409.00+128 AND 559.00. (C-CHECK) RO 2/27/2020 REWORKED AND REPAIRED LH SILL DECK BETWEEN FS 409+128 AND 559 IAW REO. REFER TO CONTINUE CARD FOR STEPS ACCOMPLISHED. COMPLIED WITH SKY CARD AND FORM M-337.
3/2/2020 14:10:58,5320,DOOR SILL,FUSELAGE,R/H PRESSURE FLOOR SILL DECK IS CORRODED IN MULTIPLE LOCATIONS BETWEEN FS 409.00+128 AND 559.00. (C-CHECK) RO 2/27/2020 REMOVED AND INSTALLED FASTENERS AND BLENDED AREAS IAW CRJ 200 SRM. REPAIRED AREAS IAW BOMBARDIER REO. COMPLIED WITH SKYCARD AND FORM M-337. SEE CONTINUATION CARD OF WORK PREFORMED.
3/2/2020 14:10:58,5311,FRAME,FUSELAGE,F.S. 605 FRAME IS CORRODED BETWEEN STRG27 TO STRG 25L. (C-CHECK) RO 2/27/2020 BLENDED CORRODED AREA AT FS 605 BETWEEN STRG 27 TO 25L IAW BOMBARDIER REO COMPLETED FORM M-337 SEE ATTACHED CONTINUATION CARD AND SKY CARD FOR DETAILS OF WORK PERFORMED. NO WEIGHT CHANGE.
10/25/2005 15:13:38,2741,CONTROL UNIT,STAB TRIM,"STAB TRIM NR 2 C/B POPS WHEN STAB TRIM NR 2 IS ENGAGED. REPLACED HORIZONTAL STAB MOTOR CONTROL UNIT REF AMM 27-41-01. OPERATIONAL CHECK GOOD, REF AMM 27-41-00."
3/2/2020 14:10:58,5320,SUPPORT ANGLE,FUSELAGE,F.S. 621 BOTTOM SUPPORT ANGLE IS CRACKED BETWEEN RBL27 TO RBL36. (C-CHECK) RO 2/27/2020 CUT AWAY DAMMAGED AREA AND REPAIRED IAW BOMBARDIER REO AND CRJ 200 SRM COMPLETED SDR AND FORM M-337 SEE ATTACHED CONTINUATION CARD AND SKY CARD FOR DETAILS OF WORK PERFORMED / NO WEIGHT CHANGE REO REACCOMPLISHED
3/2/2020 14:10:58,5343,FITTING,LT MLG TRUNNION,LH MLG TRUNNION FWD FITTING WEB UPPER HOLE HAS AN INDICATION 60% FSH AT THE 6 O'CLOCK POSITION INSIDE EDGE. FAILED NDT INSPECTION. (C-CHECK) RO 2/27/2020 COMPLIED WITH REO REV -- REFERENCE M-337 AND MAJOR REPAIR SKYCARD. NO WEIGHT CHANGE NOTED
3/2/2020 14:10:58,5720,SEAL,LT WING,"METAL SEAL ON TRAILING EDGE OF L/H WING FOR FLIGHT SPOILER BETWEEN LWS 191.44 TO LWS 183.00 IS CRACKED. (C-CHECK) RO 2/27/2020 REMOVED AND REINSTALLED L/H FLIGHT SPOILER IAW CRJ 200 AMM, REMOVED UNSERVICABLE TRAILING EDGE METAL SEAL AND REPLACED WITH SERVICABLE METAL SEAL IAW CRJ 200 SRM. PERFORMED OPS TEST OF THE SPOILER/SPOILERON IAW CRJ 200 AMM OPS TEST GOOD, NO DEFECTS NOTED"
3/2/2020 14:10:58,5320,SUPPORT FITTING,FUSELAGE,"L/H AFT WINDSHIEL SUPPORT CLIP IS CRACKED. (C-CHECK) RO 2/27/2020 REMOVED, LOCATED, DRILLED AND INSTALLED L/H AFT WINDSHIELD CLIP IAW CRJ 200 SRM. SEE CONTINUATION CARD FOR DETAILS OF WORK PREFORMED AND RELATED OPS CHECKS. ALL CHECKS GOOD."
3/2/2020 14:10:58,5314,BOLT,FUSELAGE,"FORWARD KEEL BEAM ATTACHING HARDWARE IS CORRODED. THE TWO FORWARD BOLTS/NUTS AND THE L/H AFT BOLT/NUT BETWEEN FS 409+112 AND 409+128. (C-CHECK) RO 2/27/2020 REMOVED AND INSTALLED SERVICEABLE FWD KEEL BEAM ATTACHING HARDWARE BETWEEN FS 409+112 AND FS 409+ 128 IAW BOMBARDIER RIL# 3418 REV A, CALIBRATED TOOL USED WVACT 203439 S/N 061504646 CAL DUE 30-JUN-20"
3/2/2020 14:10:58,5347,SEAT TRACK,FUSELAGE,LBL 9 SEAT TRACK IS CORRODED BETWEEN FS 364.00 AND 409.00. (C-CHECK) RO 2/27/2020 FABBED SEAT TRACK IAW REO AND INSTALLED IAW CRJ 200 AMM.
3/2/2020 14:10:58,5347,SEAT TRACK,FUSELAGE,RBL 9 SEAT TRACK IS CORRODED BETWEEN FS 364.00 AND 409.00. (C-CHECK) RO 2/27/2020 FABBED SEAT TRACK IAW REO AND INSTALLED IAW CRJ 200 AMM.
3/2/2020 14:10:58,5347,SEAT TRACK,FUSELAGE,LBL 9 SEAT TRACK IS CORRODED BETWEEN FS 409.00 AND 409.00+112. (C-CHECK) RO 2/27/2020 FABBED SEAT TRACK IAW REO AND INSTALLED IAW CRJ 200 AMM.
2/29/2012 16:06:59,3350,LIGHT,CABIN,NR 1 OVERHEAD EMERGENCY LIGHT IS OUT. (FLT 5571) RELAMPED EMERGENCY LIGHT.
3/2/2020 14:10:58,5347,SEAT TRACK,FUSELAGE,RBL 9 SEAT TRACK IS CORRODED BETWEEN FS 409.00 AND 409.00+112. (C-CHECK) RO 2/27/2020 FABBED SEAT TRACK IAW REO AND INSTALLED IAW CRJ 200 AMM.
3/2/2020 14:10:58,5320,STRAP,FUSELAGE,FLOOR SUPPORT STRAP IS CORRODED AT FS 559.00 BETWEEN RBL 27 AND 42. (C-CHECK) RO 2/27/2020 REMOVED CORROSION AND FOUND SUPPORT STRAP TO BE OUT OF LIMITS. REMOVED SUPPORT STRAP AND LOCATED AND DRILLED NEW SUPPORT STRAP IAW CRJ 200.
3/2/2020 14:10:58,5320,STRAP,FUSELAGE,"FLOOR SUPPORT STRAP IS CORRODED AT FS 559.00 BETWEEN LBL 27 AND 42. (C-CHECK) RO 2/27/2020 REMOVED CORROSION FROM FLOOR SUPPORT STRAP AND FOUND TO BE OUT OF LIMITS. REMOVED, LOCATED, DRILLED AND INSTALLED NEW SUPPORT STRAP IAW CRJ 200."
3/2/2020 14:10:58,5347,SEAT TRACK,FUSELAGE,LBL 9 SEAT TRACK IS CORRODED BETWEEN FS 409.00+112 AND 559.00. (C-CHECK) RO 2/27/2020 FABBED SEAT TRACK IAW REO AND INSTALLED IAW CRJ 200 AMM
