SubmissionDate,JASCCode,PartName,PartLocation,Discrepancy
5/21/2010 10:18:44,5751,SKIN,LT WING AILERON,TOP SIDE OF LT AILERON L/T IS CHAFED. REPAIRED LT AILERON UPPER L/E SKIN IAW REO 601R-57-60-013 AND REO 601R-57-60-071.
12/6/2016 9:12:47,3234,CONTROL HANDLE,MLG,"FLT.4127, NO GEAR MOVEMENT AFTER LANDING GEAR LEVER BROUGHT UP. NO GEAR DISAGREE MESSAGE. ALL LANDING GEAR INDICATION LIGHTS STAYED GREEN. PARKING BRAKE SOV CAUTION MESSAGE APPEARED WHEN GEAR LEVER SELECTED UP, CLEARED WHEN GEAR LEVER SELECTED DOWN. ANTISKID INBOARD CAUTION MESSAGE APPEARED WHEN GEAR LEVER SELECTED UP. CLEARED WHEN GEAR LEVER SELECTED DOWN. R & R LANDING GEAR CONTROL HANDLE IAW AMM 32-31-01, REQUIRES LANDING GEAR RETRACTION CHECK IAW AMM TASK32-30-00-720-801. PERFORMED LANDING GEAR RETRACTION FUNCTIONAL TESTED IAW AMM 32-30-00-720-801, OPS CHECKED GOOD. OPS CHECKED PARK BRAKE SOV IAW AMM 32-45-11, OPS CHECKED GOOD. OPS CHECK ANTIISKID CONTROL SYSTEM IAW AMM 32-44-00, OPS CHECKED GOOD"
5/25/2018 15:36:21,5330,SKIN,FUSELAGE,REPAIR FS193-FS202.75 STGR16L COCKPIT LT SIDE SKIN BETWEEN FS193.00 - FS210.0 AND STGR16L-STGR20L (RVSM AREA).
5/25/2018 15:36:21,2750,GUIDE,TE FLAP,"LT WING OUTBD FLAP, INBD FLAP ROLLER GUIDE HAS ABRASION/WEAR. REPLACED"
5/23/2018 10:11:08,5751,SKIN,RT AILERON,RIGHT AILERON UPPER CLOSEOUT SKIN CHAFED. REPLACED SKIN IAW SRM 51-42-21.
5/21/2018 10:10:04,5320,STRAP,FUSELAGE,"ELONGATED HOLE IN FLOOR STRAP AT FS559.00, LBL38. REPLACED STRAP IAW SRM 51-45-00, 51-42-06."
5/21/2018 10:10:04,5320,FITTING,COCKPIT,FLIGHT DECK WINDSHIELD CENTER POST LOWER LT FITTING IS CRACKED. REPLACED WINDSHIELD CENTER POST LOWER LT FITTING IAW SRM 51-42-21.
5/21/2018 10:10:04,5311,FRAME,FUSELAGE,FS280 RBL9 FRAME HAS A CRACK.
5/21/2018 10:10:04,5753,SKIN,TE FLAP VANE,"RT I/B FLAP VANE, I/B AND O/B LEADING EDGE CHAFED. REPLACED I/B SKIN AND REPAIRED O/B SKIN IAW REO M601R-57-52-004 AND SRM 51-42-13."
5/21/2018 10:10:04,5320,INTERCOSTAL,FUSELAGE,STG 15L CLIP INTERCOSTAL AT FS621 BULKHEAD AFT FACE IS CRACKED.
5/21/2018 10:10:04,5347,SEAT TRACK,FUSELAGE,LT SIDEWALL SEAT TRACK NR 4 CORRODED. REPLACED SEAT TRACK NR 4 IAW SUPP 13-074 AND AMM 53-01-11.
5/21/2018 10:10:04,5320,SUPPORT ANGLE,FUSELAGE,FS280 LBL9 FWD FLOOR SUPPORT ANGLE CORRODED.
5/25/2018 15:36:21,5320,INTERCOSTAL,FUSELAGE,STR 15L FS 621-625 INTERCOSTAL MEMBER AT FS 621 BULKHEAD AFT FACE IS CRACKED. REPLACED.
5/25/2018 15:36:21,5753,SKIN,TE FLAP VANE,"LT WING AT WS264, O/B FLAP FIXED VANE L/E SKIN GOUGED. REPLACED SKIN IAW SRM 51-42-13."
5/25/2018 15:36:21,5320,LANDING,FUSELAGE,LT TRU DOOR AFT LATCH CUTOUT ON PNL LANDING CRACKED.
5/25/2018 15:36:21,5753,SKIN,TE FLAP,RIGHT O/B FLAP LOWER SKIN IS DENTED. REPAIRED FLAP IAW REO 601R-57-53-1125 REV-B.
5/21/2018 10:10:04,5320,DOOR SILL,FUSELAGE,FS313 RT FLOOR SILL SPOT OF CORROSION FWD OF SERVICE DOOR.
5/21/2018 10:10:04,5753,SKIN,TE FLAP VANE,LT I/B FLAP VANE HAS THREE L/E CHAFES.
5/21/2018 10:10:04,5320,FITTING,FUSELAGE,AT FS 280 AND LBL 9 CRACKED CLIP.
5/21/2018 10:10:04,2750,GUIDE PLATE,TE FLAP,RIGHT I/B FLAP I/B HINGE ARM I/B FAIRING GUIDE PLATE IS DENTED.
5/25/2016 10:21:29,5240,SHAFT,SERVICE DOOR,"SERVICE DOOR OUTER HANDLE WILL NOT OPEN FROM OUTSIDE USING PUSHBUTTON. INSPECTED SERVICE DOOR OUTER HANDLE & LUBRICATED IAW SUPP 11-029B, NO FIX. FOUND CRACK IN OUTER SERVICE DOOR OUTER HANDLE SHAFT. DOOR CLOSES, LATCHES & LOCKS NORMALLY."
4/23/2010 7:29:52,5320,INTERCOSTAL,FUSELAGE,NR 2 SYS RETURN FILTER BRACKET IS CRACKED. R & R HYD SUPPORT STRUCTURE INTERCOSTAL PN 600-75221-130 IAW SRM 51-42-06.
4/23/2010 7:46:18,7110,COWLING,LT ENGINE,"LT LOWER CORE COWL INNER SKIN PUNCTURED IN CTR REPAIRED BY CUTOUT FILLER AND DOUBLER IAW CMM 71-12-01. REPAIR SRS046 AND REO 601R-71-12-3976, REV A."
4/23/2010 8:35:58,5345,BRACKET,RT MLG WW,"BRAKE PRESSURE TRANSDUCER BRACKET IN RT WHEEL WELL WALL IS CRACKED. R & R BRACKET PN 601R75262-157 IAW SRM 51-40-11, 51-23-00, 51-42-21, AND 51-21-16."
4/23/2010 8:40:40,7110,COWLING,LT ENGINE,"L/N LOWER CORE COWL INNER SKIN PUNCTURED AT 6"" INBD OF FWD HINGE. REPAIRED LT LOWER CORE COWL INNER SKIN, 6"" INBD OF FWD HINGE IAW CMM 71-12-01, REPAIR NR SRS046."
1/18/2013 7:54:09,3260,WARNING SYSTEM,COCKPIT,"AFTER T/O FROM GSO, RECEIVED GEAR DISAGREE AND NOSE DOOR OPEN MSG FLAPS WERE AT 8. RAN QRH. MSG'S WENT AWAY WHEN HANDLE WAS PLACED DOWN. LANDED AT 44600 GROSS, ROLL-OUT AND BRAKING WERE NORMAL. FERRY TO ORF."
9/9/2013 15:48:03,3444,ANTENNA,RADIO ALTIMETER,RECEIVED ERRONEOUS GPWS TERRAIN/ TERRAIN/ PULL UP WARNING ON CLIMB OUT. RAD ALT IND 700 FT AT 4000 FT. R & R RADIO ALTIMETER ANTENNA FWD POSITION IAW AMM 34-44-07 AND AWAC SUP 07-035A AND SUP 07-34E. OPS CHECK GOOD AT THIS TIME.
3/16/2021 13:06:55,5210,SEAL,PAX DOOR,"PASSING THROUGH 8000 MSL CLIMBING, PAX DOOR HAD VERY LOUD NOISE OF AIR RUSHING OUT OF A/C. PRESSURIZATION OF A/C COULD NOT KEEP UP. BELIEVE A/C WAS PRESSURIZING. LOUD NOISE OF AIR CONTINUED THROUGHOUT ARRIVAL. RETURNED TO IAD. ***AIRCRAFT REMOVED FROM SERVICE*** R&R PAX DOOR SEAL IAW AMM 52-11-10 .REF 318911/ 1 FOR OPS AND LEAK CK."
4/23/2010 9:05:29,5744,ATTACH FITTING,LT WING,LT OTBD FLAP OTBD HINGE BOX ATTACH FITTING IS CHAFED. REPAIRED LT OTBD FLAP HINGE BOX AFT FITTING BY BLENDING IAW REO 601R-57-21-1264 ORIGINAL ISSUE.
4/23/2010 9:02:08,5320,FLOOR SUPPORT,FUSELAGE,FLOOR SUPPORT CRACKED AT FS 280 APPROX LBL 9 BY MLG MANUAL RELEASE CABLE PULLEY BRACKET REO 601R-53-11-138 CARRIED OUT.
3/10/2017 16:20:32,3397,CONNECTOR,CABIN,"4031 EMERGENCY LIGHTS NO ILLUMINATING PAST ROW 8 TO THE BACK OF AIRCRAFT ON FLOOR. FOUND CONNECTORS P40LY AND P39LY BAD. REMOVED AND REPLACED BOTH CONNECTORS IAW AMM 16-371A, OPS CHECKED GOOD,"
1/8/2007 7:47:27,2750,FLAP SYSTEM,TE FLAPS,"FLAPS FAILED TO EXTEND WHEN SELECTED ON APPROACH. COMPLIED WITH SUPPLEMENT 98-018A, FLAP RESET AND OPERATE NORMALLY. (K)"
4/29/2016 8:20:45,5320,INTERCOSTAL,FUSELAGE,"AFT ACCESSORY COMPARTMENT STATION 621, BULKHEAD AFT SIDE LT INTERCOSTAL STRINGER 13L, CLIP IS CRACKED. REPLACED IAW SRM 51-42-21."
4/29/2016 8:20:45,5340,FITTING,FUSELAGE,"AFT ACCESSORY COMPARTMENT STATION 621.0, BULKHEAD AFT SIDE LT INTERCOSTAL STRINGER 14L, CLIP IS CRACKED. REPAIRED IAW SRM 51-42-01."
4/29/2016 8:20:45,5420,RETAINER,LT PYLON,LEFT PYLON PANEL 412DB HAS A CRACKED SEAL RETAINER. REPLACED SEAL RETAINER ON LT PYLON PANEL 412DB IAW SRM 51-42-06.
4/29/2016 8:20:45,7830,PLATE,THRUST REVERSER,RIGHT THRUST REVERSER PDU CONNECTOR PLUG MOUNTING PLATE IS CRACKED. REPLACED RT THRUST REVERSER PDU MOUNT PLATE IAW SRM 51-42-06.
4/29/2016 8:20:45,5330,SKIN,FUSELAGE,"AFT LOWER FUSELAGE SKIN, BETWEEN FS 654.0 & 672.20, STRINGER 26R - 27 HAS A DENT. REPAIRED AFT LOWER FUSELAGE SKIN IAW EA AWAC CRJ253 00359 REV IR DATED 04 16 2016."
4/29/2016 8:20:45,5320,CLEAT,FUSELAGE,PASSENGER DOOR SILL FWD CLEAT HAS CORROSION. REPLACED PAX DOOR FWD CLEAT IAW SRM 51-42-06 & 51-42-10.
4/29/2016 8:20:45,5311,FRAME,FUSELAGE,"FRAME 333.00 HAS CORROSION ON THE FWD SIDE, BETWEEN STRINGER 23R & 22R, IN THE FWD E & E BAY. REPLACED FRAME 333.00 SECTION, BETWEEN STRINGER 23R & 18R IAW SRM 51-42-06 & 51-42-21."
4/29/2016 8:20:45,5520,BRACKET,FUSELAGE,CRACKED BRACKET UNDER PANEL 326CR. REPLACED BRACKET IAW SRM 51-24-21 & 51-11-20.
4/29/2016 8:20:45,5753,ATTACH BRACKET,TE FLAP,"LEFT OTBD FLAP CTR HINGE ARM, OTBD FAIRING ATTACH BRACKET IS CRACKED. R & R ATTACH BRACKET IAW SRM 51-40-11, 51-42-06 & 51-25-16."
5/3/2006 11:40:39,5320,ANGLE,FUSELAGE,"FS 484 ANGLE CRACKED AT LBL 36 APPROX .5 INCH LONG. (K) MAINTENANCE REPAIRED FLANGE AT FS 484, LBL 36 IAW BOMBARDIER REO 601R-53-41-059 REV A AND BOMBARDIER REO 601R-53-41-059 REV A AND BOMBARDIER STANDARD REPAIR 601R-53-0030A. (M)"
5/18/2006 14:52:25,5311,DOUBLER,BS 640,FOUND RIGHT SIDE FS 640 FRAME DOUBLER IS CRACKED AT STRINGER 10R APPROX 1 INCH LONG. MAINTENANCE REPAIRED BY PERFORMING JOB CARD 4EOMFG08415 AWAC EO E02/087/453 REV A INSPECTION AND MODIFICATION OF AFT FUSELAGE FRAME AT FS 640 BL 45 BETWEEN STRINGERS 9 AND 12. (M)
5/3/2006 11:36:25,5340,ANGLE,FUSELAGE,"FS 484 ANGLE CRACKED AT LBL 27 APPROX .5 INCH LONG. (K) MAINTENANCE REMOVED AND REPLACED CLIP IAW BSC STANDARD REPAIR 601R-53-0029A AND SRM 51-42-06, 51-42-21. (M)"
4/24/2007 10:05:18,2611,SMOKE DETECTOR,LAVATORY,"SMOKE TOILET CASS MESSAGE AFTER TAKEOFF WITH LAV SMOKE ALARM ACTIVATED RAN QRH, MESSAGE EXTINGUISHED ALARM OFF F/A REPPORTED NO INDICATION OF SMOKE OR FIRE ON INSPECTION. RAN ENGINE WITH APU AIR SWITCH OVER TO BLEED AIR AND NO SMOKE CAUTION MESSAGE WITH EITHER APU OR ENGINE SUPPLYING PACKS NO EXTERNAL ENGINE OIL LEAKS NOTED. SUSPECT FAULTY LAV SMOKE DETECTION SYSTEM. REMOVED AND REPLACED SMOKE DETECTOR UNIT, OPS CHECK GOOD. (K)"
4/8/2014 11:16:35,5320,FITTING,FUSELAGE,"CABIN FLOOR SUPPORT STRUCTURE FS 484 CLIP CRACKED AT RBL 27. R & R CLIP WITH SERVICEABLE CLIP IAW SRM 51-24-36, 51-40-11 & 51-42-21."
4/8/2014 11:03:59,5320,FITTING,FUSELAGE,FLOOR SUPPORT BEAM RBL 9 INBD & OTBD ATTACH CLIPS AT FS 280 ARE CRACKED. R & R CLIPS IAW REO 601R-53-11-171 & SRM 51-40-11 & 51-42-21.
4/8/2014 11:21:30,5320,FITTING,FUSELAGE,CLIP ON STRINGER 3L AT FS 280 IS CRACKED. R & R CLIP WITH SERVICEABLE PART IAW SRM 51-40-11 & 51-42-06.
4/8/2014 11:25:04,5347,CARGO TRACK,CARGO BAY,"TIE DOWN TRACK IN CARGO BAY, LBL 9 BETWEEN FS 559+112 & 574 IS CORRODED BEYOND LIMITS. R & R TRACK LBL 9 BETWEEN FS 559+112 & 574 WITH SERVICEABLE PART IAW SRM 51-40-11 & 51-41-02."
5/3/2006 11:28:18,5340,CLIP,FUSELAGE,"FS 280, LBL 9 OB CLIP IS CRACKED. (K) MAINTENANCE CRACKED CLIP AND INSTALLED NEW SERVICEABLE CLIP IAW CRJ200 SRM 51-42-06, 51-42-21. (M)"
4/8/2014 11:13:27,5240,BRACKET,SERVICE DOOR,SERVICE DOOR INNER HANDLE PROX SWITCH BRACKET CRACKED. R & R BRACKET WITH SERVICEABLE PN 601R38723-17 IAW SRM 51-40-11 & 51-42-20.
4/8/2014 13:12:09,5230,RETAINER,CARGO DOOR,CARGO DOOR LOWER SEAL RETAINERS CRACKED & GOUGED. R & R SEAL RETAINERS PN CC670-38742-1 & CC670-38746-1 IAW SRM 51-40-11 & 51-42-06.
5/3/2006 10:47:57,5340,CLIP,FUSELAGE,"FS 280, LBL 9, IB CLIP IS CRACKED. (K) MAINTENANCE REMOVED CRACKED CLIP AND INSTALLED NEW SERVICEABLE CLIP IAW CRJ 200 SRM 51-42-06 AND 51-42-21. (M)"
5/3/2006 11:31:53,5340,CLIP,FUSELAGE,"FS 280, RBL 9 IB CLIP IS CRACKED. (K) MAINTENANCE REMOVED CRACKED CLIP AND INSTALLED NEW SERVICEABLE CLIP IAW CRJ 200 SRM 51-42-06, 51-42-21. (M)"
4/8/2014 11:28:15,5320,FLOOR SUPPORT,FUSELAGE,FLOOR SUPPORT JUST AFT OF PAX DOOR HAS CORROSION. R & R FLOOR SUPPORT WITH SERVICEABLE SUPPORT IAW SRM 51-40-11.
4/8/2014 11:33:00,5320,POST,FUSELAGE,FS 409+128 LT VERTICAL POST LOWER OTBD SIDE CRACKED. REPAIRED FS 409+128 VERTICAL POST IAW REO 601R-53-41-056.
4/8/2014 11:37:50,5347,SEAT TRACK,FUSELAGE,ONE EACH TIE DOWN ON RBL 9 AT FS 559+112 HAS CORROSION. R & R CORRODED SEAT TRACK WITH NEW SERVICEABLE SEAT TRACK IAW SRM 51-40-11.
4/8/2014 11:40:48,5320,INTERCOSTAL,FUSELAGE,"REPAIR APU INLET DOOR ACT SUPPORT 13-085B. R & R DOOR ACTUATOR SUPPORT INTERCOSTAL IAW SRM 51-41-00, 51-40-11, 51-25-16 & 51-41-04."
4/8/2014 11:43:36,5320,TIE DOWN,FUSELAGE,THREE EACH TIE DOWNS ON LBL 27 AT FS 574 TO 559+96 HAVE CORROSION. R & R THREE EACH TIE DOWNS ON LBL 27 AT 574 TO 559+96 IAW AMM 2021-00.
4/8/2014 11:47:09,5347,SEAT TRACK,FUSELAGE,"RIGHT SEAT TRACK HAS CORROSION AT FS 559+96 TO 554.00. REMOVED & INSTALLED NEW SERVICEABLE SEAT TRACK IAW SRM 53-41-49, 51-29-36 & 51-41-02."
5/3/2006 10:43:14,5340,CLIP,FUSELAGE,"FS 280, RBL 9 OB CLIP IS CRACKED. CA IN PROGRESS. (K) MAINTENANCE REMOVED CRACKED CLIP AND INSTALLED NEW SERVICEABLE CLIP IAW CRJ 200 SRM 51-42-06, 51-42-21, 51-42-13, AND BOMBARDIER STANDARD REPAIR 601R-53-0057A. (M)"
4/8/2014 13:25:32,5242,RETAINER,E&E BAY,"AVIONICS BAY DOOR SEAL RETAINERS CORRODED. R & R SEAL RETAINERS PN CC670-38662-5, CC670-38663-5, CC670-38674-3 & CC670-38675-3."
4/8/2014 13:31:39,5740,BRACKET,RT WING,RIGHT LE TRANSITION DUCT OTBD BRACKET CRACKED. R & R BRACKET PN 600-12045-12 IAW SRM 51-40-11 & 51-41-00.
4/8/2014 13:28:36,5315,FLOORBEAM,FUSELAGE,"FLOORBEAM CAP CORRODED, LBL 27 FROM FS 559+112 TO 621. R & R FLOORBEAM CAP SECTION, FS 567 TO 612 IAW SRM 51-40-11 & 51-42-21. REPAIRED CAP END FITTING AT FS 615 ON OTBD FLANGE OF LBL 27 FLOORBEAM CAP IAW EA 15-2014-070 DATED 3/31/2014."
4/10/2008 13:53:48,5270,WARNING LIGHT,EMERGENCY DOOR,"RIGHT EMERGENCY DOOR OVERWING CAUTION MESSAGE IN CRUISE. COMPLIED WITH QRH MESSAGE DISAPPEARED AFTER LANDING AND AIRCRAFT DEPRESSURIZED. CLEARED PSEU FAULTS REF AMM 32-60-00 AND PRESSURIZED AIRCRAFT, NO DEFECTS NOTED AT THIS TIME, AIRCRAFT OK TO CONTINUE SERVICE. (M)"
9/28/2020 9:12:41,5312,BULKHEAD WEB,BS 621,"PERFORMED SDI OF AFT PRESSURE BULKHEAD FWD FACE, IAW NDTM AWAC SUPPLEMENT 09-008 REV 41. PERFORMED EDDY CURRENT INSPECTION, IAW NDTM PART 1 51-20-06 REV 41. PERFORMED UT INSPECTION, IAW NDTM PART 4 53-61-153 REV 41. 5 EACH DISCREPANCIES. DISCREPANCY 1: FS 621 LBL 27.5 WL 108.5 TO 109 CRACK LENGTH .5"". DISCREPANCY 2: FS 621 BL 00 WL 127.18 TO 135.43 CRACK LENGTH 8.25"". DISCREPANCY 3: FS 621 BL 00 WL 112.93 TO 108.43 CRACK LENGTH 4.5"". DISCREPANCY 4: FS 621 RBL 18.0 WL 131.93 TO 134.94 CRACK LENGTH 3"". DISCREPANCY 5: FS 621 RBL 18.0 WL 110.18 TO 109.43 CRACK LENGTH .75"". AIRCRAFT REMOVED FROM SERVICE. MODIFICATION OF AFT PRESSURE BULKHEAD WEB, IAW E.O E17/003/453 REV DATE SEP 28, 2018. TO BE ACCOMPLISHED ON AERSALE W/O002862 CARD NO 4EOAWA21045."
9/28/2020 9:12:41,5320,INTERCOSTAL,BS 621 BULKHEAD,"AFT PRESSURE BULKHEAD AT FS 621.00. RT INTERCOSTAL AT RBL 45.70 & S 14R HAS A CRACK. AIRCRAFT REMOVED FROM SERVICE. FABRICATED INTERCOSTAL P/N 601-35012-52 OUT OF .050"" 7075 T6, REF SRM 53-61-17 REV 38. INSTALLED RT INTERCOSTAL, REF SRM 51-42-21 REV 38."
4/10/2008 13:20:30,5270,WARNING LIGHT,EMERGENCY DOOR,"RIGHT EMERGENCY DOOR CAUTION MESSAGE ON CLIMB-OUT AT 13,000 FT, NORMAL PRESSURIZATION. COMPLIED WITH QRH. (M)"
4/9/2014 11:30:22,5320,ATTACH BRACKET,FUSELAGE,CARGO DOOR FWD TRACK LOWER ATTACH BRACKET IS CRACKED. R & R BRACKET PN 601R35050-25 IAW SRM 51-40-11 & 51-42-06.
4/9/2014 11:33:28,5210,SUPPORT,PAX DOOR,PAX DOOR POWER ASSIST MOTOR LOWER SUPPORT IS CRACKED. R & R PAX DOOR ASSIST MOTOR LOWER SUPPORT BRACKET PN 601R317745-7.
4/9/2014 11:36:45,5720,BRACKET,LT WING,LEFT WING LE CTR TRANSITION INBD BRACKET CRACKED. R & R BRACKET 600-12045-11 IAW SRM 51-40-11 & 51-41-02.
4/16/2010 7:19:57,5340,ATTACH FITTING,BS 484,"FS 484, CLIP LBL 35"" CRCKED. R&R CRACKED CLIP AT FS 484, LBL 35 WITH SERVICEABLE CLIP IAW REO 601R-53-41-059."
3/30/2017 10:49:27,3397,CONNECTOR,EMERGENCY LIGHTS,"FLOOR EMERGENCY LIGHTS WILL NOT REMAIN ILLUMINATED FROM ROWS 8-12. IT COMES ON THEN FADES OUT. SECURED THE CONNECTOR P40LY IAW 16-371A, OPS CHECKED GOOD."
4/10/2008 14:21:37,2760,SWITCH,,"CPLT ROLL CMD MESSAGE ON ED2 INFLIGHT. GREEN CPLT ROLL LIGHT ILLUMINATED ON GLARESHIELD. ALL FLIGHT CONTROL RESPONDED NORMAL. REPLACED CO-PILOT ROLL PRIORITY SWITCH PER AMM 27-61-20. OPS TEST GOOD. ALSO, PERFORMED OPS TEST OF ROLL PRIORITY SYSTEM PER AMM TASK 27-61-20-710-810. NO DEFECTS NOTED. OK FOR SERVICE. (M)"
5/21/2014 15:27:02,2120,UNKNOWN,COCKPIT,"INTERMITTENT ELEC ODOR DURING CRUISE FLIGHT, ODOR WAS ASSOCIATED WITH COCKPIT AREA ONLY & DECREASED IN INTENSITY AT LWR ALTITUDE. INSPECTED AREA FOR ODORS IN AVIONICS BAY, JUNCTION BOX 1 AREA, COCKPIT, THROUGH BAY & AFT EQUIPMENT BAY. NOTHING UNUSUAL NOTED. RAN AIR CONDITIONING PACKS, BOTH DISPLAY COOL FANS, BOTH ARINC FANS & WINDSHIELD HEATS. NO DEFECTS NOTED. MDC SHOWED NO FAULTS & NO CIRCUIT BREAKERS FOUND TRIPPED. UNABLE TO DUPLICATE PROBLEM."
10/2/2009 8:11:13,8011,CARBON SEAL,STARTER,"RT LOW OIL PRESS ON DESCENT. PRESS BELOW 25 PSI, RAN QRH. ACCOMPLISHED PRECAUTIONARY ENGINE SHUTDOWN. DECLARED EMERGENCY LANDING. REF MAINT W/O 142728 FOR ALL WORK PERFORMED. LEAK CHECK GOOD ON GROUND AT THIS TIME. REMOVED AND REPLACED IDG, EDP, AND AIR TURBINE STARTER CARBON SEALS IAW SUPP 05-018A. (K)"
4/16/2010 7:08:02,5340,SUPPORT BRACKET,LT MLG WW,BRAKE PRESSURE TRANSDUCER SUPPORT BRACKET IN LT MLG W/W IS CRACKED BRACKET. R & R IAW SRM 51-42-06.
4/12/2019 8:41:20,2722,ELEVATOR SYSTEM,,ON TAKE OFF AC REQUIRED EXCESSIVE BACK PRESSURE TO ROTATE. ELEVATOR CONTROLS FEEL HEAVY AND SLOW TO REACT TO CONTROL WHEEL INPUTS. AC CAN BE TRIMMED FOR FLT. DID NOT ENGAGE AUTOPILOT. THERE IS SLACK IN THE CONTROLS (EXCESSIVE HYSTERESIS) COORDINATED WITH DISPATCH AND DECIDED TO DIVERT WITH NO EMERGENCY AND DID NOT LAND OVER WEIGHT.
4/23/2010 7:37:09,5414,COWLING,LT NACELLE,"LT LOWER CORE COWL CHAFED IN CTR APPROX 6 "" FROM DOME. REPAIRED IAW CMM 71-12-01, REPAIR NO SRS064 & REO 601R-71-12-3976."
3/28/2006 12:51:32,5313,STRINGER,"S26L, FS280","STRINGER 26L, 10 INCHES FWD OF FS 280 IS DAMAGED. (K) MAINTENANCE REMOVED DAMAGED SECTION OF STRINGER 26L FROM FS 257 TO FS 272. FABRICATED SECTION OF REPAIR STRINGER AND SPLICES FROM P/N 600-33011-161. INSTALLED REPAIRED STRINGER AND SPLICES IAW BSC EO 601R-53-8695. (M)"
4/16/2010 7:15:43,5280,DOOR,RT MLG,RT MLG DOOR CHAFED ON L/E. REPAIRED IAW REO 601R-52-82-102 SECTION A-A CUT IN Z MEMBER ONLY.
4/5/2006 13:00:57,5730,SKIN,RT WING,"RT LWR WING PLANK HOLE NR 16, WS 303.861 HAS CORROSION AROUND ENTIRE CIRCUMFERENCE .002 INCH-.003 INCH DEEP. (K) MAINTENANCE REPAIRED RIGHT WING LOWER PLANK FUEL TANK ACCESS DOOR CUTOUT BY REMOVING CORROSION AND TREATING AREA AT PANEL 650HB, WS 303.861, HOLE NR 16 MAX DEPTH OF REPAIR WAS .003 INCH DEEP BOMBARDIER REO 601R-57-21-030 REV D. (M)"
5/21/2014 15:34:01,3040,SCREW,WINDOW HEAT,"FIRST OFFICER`S WINDSHIELD HEAT TERMINAL BLOCK COVER SMOKING INFLIGHT, WINDSHIELD HEAT OFF SMOKING STOPPED. INSPECTED & FOUND LWR TERMINAL BLOCK SCREW LOOSE CAUSING MOVEMENT & ARCING. SCREW, TERMINAL & TERMINAL BLOCK SHOW EVIDENCE OF DAMAGEFROM ARCING. FOUND ONE WASHER & SPACER MISSING. INSPECTED FIRST OFFICER`S WINDSHIELD& FOUND NO EVIDENCE OF DELAMINATION OR ARCING DAMAGE IAW AMM 56-11-01. PLACED ON MEL."
4/3/2006 13:37:19,5320,INTERCOSTAL,STR 14R,RT SIDE FS 621.0 TO FS 625.3 INTERCOSTAL AT STRINGER 14R IS CRACKED NEAR RADIUS APPROX 1.1 INCH LONG. CORRECTIVE ACTION IN PROGRESS. (K)
2/20/2008 13:47:02,5240,DOOR,SERVICE DOOR,REQUEST INSPECTION FOR OPERATION OF SERVICE DOOR. (DOOR OPENS ABNORMALLY). (K)
4/16/2010 7:04:24,5321,PLATE,BS 589,"CARGO FLOOR LANDING PLATE CRACKED AT FS 589. REPAIRED IAW REO 601R-53-61-433, REV B."
4/13/2012 13:25:35,5320,SILL,PAX DOOR,"PAX DOOR CUT OUT LOWER SILL IS CORRODED IN SEVERAL PLACES ALONG THE ENTIRE LENGTH OF THE SILL. REMOVED CORRODED PAX DOOR LOWER SILL THEN FABRICATED NEW LOWER SILL AND INSTALLED IAW SRM 51-24-16, 51-40-02, 51-42-06, 51-42-13."
4/3/2006 14:08:46,5311,DOUBLER,FUSELAGE,RT SIDE FS 640 FRAME DOUBLER IS CRACKED AT STRINGER 10R APPROX 1.0 INCH LONG. CORRECTIVE ACTION IN PROGRESS. (K)
8/7/2009 10:41:47,2730,WASHER,WIRE LOCK RING,DURING ALL PHASES OF FLT FELT OCCASSIONAL ELEVATOR BINDING AND GRAB DURING PITCH CHANGES SPECIFICALLY WHEN PULLING BACK ON YOKE. BINDS/ GRABBING OCCURRED WITH A/P ON OR OFF. WHEN A/P ON THE BINDING/ GRABBING WAS VISIBLE BUT NO CHANGE IN PITCH OR ATTITUDE OCCURRED. BINDING/ GRABBING OCCURRED AT ALL ALTITUDES AND AIRSPEEDS AND DIDN`T VARY IN FORCE. NOTED BINDING OF YOKE IN NOSE UP POS FOUND WASHERS ON WIRE LOCK RING TO BE INSTALLED IMPROPERLY CAUSING WASHERS TO BIND AGAINST PITCH A/PILOT SERVO. PROPERLY INSTALLED HARDWARE FOR EFFECTIVITY IAW CMM 22-10-84. OPS CK GOOD. (K)
8/7/2009 9:57:08,2730,ELEVATOR SYSTEM,,"DURING CLIMBOUT EXPERIENCED ELEVATOR STICKING AT 8,000 FT INTERMITTENTLY. UNAFFECTED BY ALTITUDE OR SPEED CHANGES OR AUTOPILOT ENGAGED OR DISENGAGES. NOT PRESENT BELOW 10,000 FT OR ON GROUND. (K)"
4/11/2014 13:47:57,5210,SUPPORT,PAX DOOR,54527-8000-0017 PAX DOOR FWD STAIR SUPPORT PANEL CRACKED AT LOWER RISER. REPAIRED IAW SUPPLEMENT 13-134 DATED 12/9/2013.
5/25/2016 10:21:29,5240,PIN,SERVICE DOOR,SERVICE DOOR OUTER HANDLE PUSH TO RELEASE BUTTON STUCK. ADJUSTED SERVICE DOOR OUTER HANDLE RETENTION PIN AS REQUIRED. OPERATIONS CHECKED GOOD IAW AMM 52-41-03.
4/11/2014 13:50:31,5210,SUPPORT,PAX DOOR,54527-8000-0043 PAX DOOR AFT STAIR SUPPORT PANEL CRACKED AT PREVIOUS REPAIR. REMOVED EXISTING DOUBLER & REPAIRED PAX DOOR AFT STAIR SUPPORT PANEL IAW REO 601R-52-11-702 REV C DATED 2010-03-09.
4/11/2014 14:00:54,5320,FLOOR SKIN,E&E BAY,54527-2000-0054 FWD EQUIPMENT COMPARTMENT FLOOR SKIN CRACKED AT FRAME FS 193 ON LT OTBD SIDE. REPAIRED IAW REO 601R-53-11-111 REV NC DATED 98 - MAR - 18.
4/11/2014 14:06:45,5320,MOUNT BRACKET,FUSELAGE,ACFT GND POWER PLUG MOUNT BRACKET CRACKED. R & R BRACKET PN 600-33283-33 IAW SRM 51-40-11 & REO 601R-53-11-009 REV A.
4/11/2014 14:10:07,5230,HOUSING,CARGO DOOR,CARGO DOOR OUTER HANDLE HOUSING CRACKED. R & R CARGO DOOR OUTER HANDLE HOUSING PN H3415-31 IAW SRM 51-40-11 & 51-42-21.
4/11/2014 14:12:30,5347,SEAT TRACK,FUSELAGE,LEFT SEAT TRACK AT FS 364 THROUGH 394 HAS CORROSION. REMOVED CORROSION & FOUND TO BE OUT OF LIMITS IAW SRM 51-21-06 & SRM 53-21-49. REMOVED DAMAGED SEAT TRACK & INSTALLED NEW SEAT TRACK IAW SRM 51-41-00 & REO 601R 53-00-485.
4/11/2014 14:16:18,5312,BULKHEAD,FUSELAGE,"FORWARD FACE OF FS 621 PRESS BULKHEAD HAS SCREW DAMAGE IN TWO PREVIOUSLY BLENDED & DENTED LOCATIONS, RT SIDE BETWEEN RBL 27 & RBL 45 APPROXIMATELY WL 75. REPAIRED TWO LOCATIONS ON FS 621 BULKHEAD IAW REO 601R-53-61-5252 DATED 2014-04-09."
4/11/2014 14:19:12,5330,SKIN,FUSELAGE,"FUSELAGE SKIN CRACKED AT FS 235, RT AFT RADIUS OF NLG CUT OUT. REPAIRED IAW REO 601R-53-11-048 REV C DATED 2008-10-01."
4/11/2014 14:21:21,5210,SUPPORT,PAX DOOR,PAX DOOR TOP STEP AFT SUPPORT IS CORRODED. REPAIRED TOP STEP AFT SUPPORT IAW EA 15-2014-077.
4/14/2014 6:52:42,7810,SKIN,RT JET PIPE,RIGHT JET PIPE FAIRING OUTER SKIN NEAR UPPER INBD MOUNT IS PUNCTURED. REPAIRED DAMAGE AREA NEAR UPPER INBD MOUNT ACCESS PANEL IAW CMM 78-11-00 REPAIR SRS 062.
5/4/2016 8:23:33,5311,FRAME,FUSELAGE,"FRAME 310.00 HAS CORROSION ON THE FWD & AFT SIDES, BETWEEN STRINGER 23R & 22R, IN THE FWD E & E BAY. REPLACED FRAME 310.00 IAW SRM 51-42-21, 51-42-06, 51-42-13, 51-21-11, 51-25-06 & 51-25-16."
5/4/2016 8:23:33,5320,ATTACH FITTING,FUSELAGE,FLOOR SUPPORT ATTACHMENT FITTING FS 349.00 AT RT SILL HAS CORROSION. REPLACED FLOOR SUPPORT ATTACHMENT FITTING AT FS 349.00 AT RT SILL IAW SRM 51-42-21.
5/4/2016 8:23:33,5311,FRAME,FUSELAGE,"FS FRAME 333.00, BETWEEN STRINGER 0 & 1L IS CRACKED. REPLACED FRAME 333.00 IAW SRM 51-40-11, 51-42-06, 51-42-21 & 53-21-15."
5/4/2016 8:24:16,5320,STRAP,FUSELAGE,SERVICE DOOR SILL T STRAP FS 349.00 HAS CORROSION.
4/5/2006 13:04:47,5346,WEB,AFT FUSELAGE,"ENGINE SUPPORT BEAM LOWER WEB CRACKED LT SIDE FROM ACCESS PANEL NUTPLATE, APPROX FS 628, LBL 39, WL 111.09. (K) MAINTENANCE REPAIRED LOWER WEB BY INCORPORATION AWAC E02/081/453 MODIFICATION OF THE ENGINE SUPPORT BEAM (BOMBARDIER SERVICE BULLETIN A601R-53-059 REV D). (M)"
4/5/2006 13:14:01,5730,SKIN,LT WING,"LT LWR WING PLANK HOLE NR 2, WS 12.245, HAS CORROSION AT IB SIDE 3.5 INCH L X .002 INCH-.003 INCH DEEP. (K) MAINTENANCE REPAIRED LEFT WING LOWER PLANK FUEL TANK ACCESS DOOR CUTOUT AT PANEL 510AB, WS 12.245, HOLE NR 2 BY REMOVING CORROSION ON INBOARD EDGE TO A MAX DEPTH OF .003 INCH IAW BOMBARDIER REO 601R-57-21-030 REV D. (M)"
4/5/2006 12:50:21,5730,SKIN,LT WING,"LT LWR WING PLANK, HOLE NR 11, WS 209.040, HAS CORROSION ON AFT OB SIDE 8.5 INCH L X .002 INCH, .003 INCH DEEP. (K) MAINTENANCE REPAIRED LEFT WING LOWER PLANK FUEL TANK ACCESS DOOR CUTOUT AT PANEL 550CB, WS 209.040, HOLE NR 11 OUTBOARD EDGE BY REMOVING CORROSION TO A MAX DEPTH OF .003 INCH IAW BOMBARDIER REO 601R-57-21-030 REV D. (M)"
4/3/2006 12:08:48,5330,SKIN,,DENT FWD AND LT OF NOSE JACK POINT .8 INCH X 14 INCH AND .2500 INCH DEEP. CORRECTIVE ACTION IN PROGRESS. (K) MAINTENANCE REPAIRED FUSELAGE SKIN AT FS 272 STRINGER.
4/5/2006 12:56:01,5730,SKIN,LT WING,"LT WING, LWR WING PLANK, HOLE NR 1, WS 54.897, HAS CORROSION AT IB SIDE 12 INCH L X .002 INCH-.003 INCH DEEP AND OB FWD SIDE 1 INCH L X .001 INCH - .002 INCH DEEP AND AT OB FWD SIDE 1 INCH L X .001 INCH- .002 INCH DEEP. (K) MAINTENANCE REPAIRED LEFT WING LOWER PLANK FUEL TANK ACCESS DOOR CUTOUT AT PANEL 540BB, WAS 54.897 HOLE NR 1 INBOARD AND OUTBOARD EDGES BY REMOVING CORROSION TO A MAX DEPTH OF .003 INCH IAW BOMBARDIER REO 601R-57-21-030 REV D. (M)"
4/5/2006 13:08:47,5730,SKIN,FUSELAGE,"LT LWR WING PLANK, HOLE NR 16, WS 303.861, HAS CORROSION AROUND ENTIRE CIRCUMFERENCE, .002 INCH- .003 INCH DEEP. (K) MAINTENANCE LEFT WING LOWER PLANK FUEL TANK ACCESS DOOR CUT OUT AT PANEL 550HB, WS 303.861, HOLE NR 16 BY REMOVING CORROSION TO A MAX DEPTH OF .003 INCH IAW BOMBARDIER REO 601R-57-21-030 REV D. (M)"
4/3/2006 13:32:32,5320,INTERCOSTAL,FUSELAGE,LT SIDE FS 621.0 TO FS 625.3 INTERCOSTAL AT STRINGER 14L IS CRACKED NEAR RADIUS APPROX 1.0 INCH LONG. (K) MAINTENANCE REMOVED AND REPLACED FS 621 TO 625.3 INTERCOSTAL AT STRINGER 14L IAW CRJ SRM 51-42-06. (M)
4/17/2008 12:35:12,5730,SKIN,RT WING,"RIGHT WING LE, 620AT, AT WS 140 EDGING IS CRACKED IN RADIUS. RIGHT WING INBOARD L/E (620AT) WS 140 SHROUD CRACK REMOVED IAW REO 601R-57-41-502. (M)"
4/17/2008 12:36:30,5347,CARGO TRACK,BS 567,ONE CARGO TRACK CORRODED IN CARGO BAY AT FS 567 LBL 9. CORROSION REMOVED IAW CRJ 200 SRM 51-21-06 OUT OF LIMITS IAW CRJ 200 SRM 53-61-49 THEREFORE SEAT RAIL AT FS 567 RBL 9. REPLACED IAW CRJ 200 SRM 51-40-11 AND 51-41-02. (M)
4/17/2008 12:37:37,5340,ATTACH FITTING,BS 484,"CLIPS CRACKED ON INTERCOSTALS AT FS 484, RBL 27 AND RBL 36. INBOARD CLIP REPLACED IAW SRM 51-42-21, OUTBOARD CLIP, REPLACED IAW REO 601R-53-41-059. (M)"
4/14/2014 12:15:59,5755,SEAL,LT SPOILER,LEFT FLIGHT SPOILER SPRING SEAL CRACKED. REMOVED UNSERVICEABLE SEAL & INSTALLED SERVICEABLE SEAL IAW SRM 51-42-06 & 51-42-21.
4/17/2008 12:53:50,2910,MANIFOLD,HYD SYSTEM,NR 2 HYDRAULIC MANIFOLD CRACKED ON AFT LOWER CORNER P/N 600-75221-130. NR 2 HYDRAULIC MANIFOLD SUPPORT BRACKET REPAIRED. (M)
